{
  "id": "cloud-identity-account-ops",
  "name": "Cloud Identity 帳號與登入管理",
  "summary": "批量建立帳號，處理登入驗證並部署安全 SSO。",
  "description": "面向 Google Cloud Identity／Google Workspace 管理工作的低自由度操作 skill。先用無秘密 tenant plan 鎖定網域、OU、帳號範圍、管理員排除名單與 pilot，再依固定狀態機完成乾跑、單一測試、批量執行、驗證和回滾。\n支援任意網域與帳號批次、Employee ID、Directory API 密碼更新、Login Challenge／Too many failed attempts、新裝置與 Google Maps 首次登入、持久化瀏覽器 profile，以及正式或受控臨時 SAML／OIDC SSO。內建 break-glass 管理員、post-SSO verification、一次性授權、秘密禁止入 Git 和完整 teardown 規則。",
  "category": "Google 管理",
  "tags": [
    "google",
    "cloud-identity",
    "workspace",
    "accounts",
    "sso",
    "admin"
  ],
  "author": "Aiapi 管理員",
  "license": "未指定",
  "version": "2.0.0",
  "usage": [
    "要為任意網域一次建立或更新一批員工帳號",
    "帳號登入時被手機驗證或 Login Challenge 擋住",
    "要讓新帳號首次登入 Google Maps 等服務並保存 profile",
    "要部署、測試或回滾正式企業 SAML／OIDC SSO",
    "要用受控臨時 SSO 完成一批帳號的一次性 onboarding"
  ],
  "highlights": [
    "用無秘密 tenant plan 固定網域、OU、帳號範圍與管理員排除名單",
    "強制執行唯讀盤點、乾跑、pilot、分批、驗證和回滾",
    "涵蓋 Employee ID、Login Challenge、新裝置與持久化 profile",
    "提供正式企業 SSO 與受控臨時 SSO 的完整部署和停止條件",
    "禁止密碼、token、Cookie、私鑰和憑證進入 Git 或日誌"
  ],
  "source": {
    "kind": "local",
    "path": "skills/cloud-identity-account-ops"
  },
  "install": {
    "dirName": "cloud-identity-account-ops",
    "scope": "user",
    "files": [
      "SKILL.md",
      "assets/tenant-plan.example.json",
      "references/batch-account-runbook.md",
      "references/login-and-sso-runbook.md",
      "scripts/plan_accounts.py",
      "scripts/batch_password_api.py"
    ],
    "notes": "tenant plan 只可包含非秘密資料；密碼、token、Cookie、SAML 私鑰、OIDC client secret 和憑證不得寫進 skill、Git、命令列或日誌。執行 Google 管理寫入需要使用者自己的管理員 session 或短效授權。"
  },
  "prompt": null,
  "links": [
    {
      "label": "Google SSO 設定",
      "url": "https://knowledge.workspace.google.com/admin/apps/setting-up-sso"
    },
    {
      "label": "Google 登入故障排查",
      "url": "https://knowledge.workspace.google.com/admin/support/troubleshooting/troubleshoot-login-challenges-2-step-verification-and-sign-in-issues"
    }
  ],
  "addedAt": "2026-08-08",
  "updatedAt": "2026-08-10"
}
