{
  "id": "plan-implementation",
  "name": "實作藍圖",
  "summary": "把驗收需求拆成可照順序完成的開發任務。",
  "description": "在需求契約和寫程式之間補上可執行的實作計畫：先探索現有專案並保存必須相容的 API、資料與行為基線，再把每個 FR／NFR 拆成有真實檔案路徑、模組責任、依賴順序、測試方式、完成證據與回滾策略的 T 編號任務。方法參考 GitHub Spec Kit 的規格／計畫／任務一致性，以及 obra/superpowers writing-plans 的檔案級小步驟與驗證順序。",
  "category": "程式品質",
  "tags": [
    "planning",
    "implementation",
    "requirements",
    "architecture",
    "testing",
    "workflow"
  ],
  "official": false,
  "featured": true,
  "author": "fengfeng1021",
  "license": "MIT",
  "version": "1.0.0",
  "usage": [
    "需求已確認，但還需要決定先改哪些檔案、模組與測試",
    "跨多個元件或資料流的功能需要避免邊寫邊改架構",
    "必須保留既有 API、資料格式或使用行為，先留下可比較基線",
    "長任務需要另一個 Agent 也能接著同一份計畫執行"
  ],
  "highlights": [
    "每個需求都會對應到檔案級任務與驗證證據",
    "先保存相容性基線，再安排實作與測試順序",
    "任務有依賴、風險與回滾方式，不會只列模糊待辦"
  ],
  "source": {
    "kind": "local",
    "url": "https://github.com/fengfeng1021/skill-hub/tree/main/skills/plan-implementation",
    "path": "skills/plan-implementation"
  },
  "install": {
    "scope": "user",
    "dirName": "plan-implementation",
    "files": [
      "SKILL.md",
      "agents/openai.yaml",
      "references/implementation-plan-method.md"
    ],
    "requires": [],
    "notes": "可獨立使用，也會由前端總指揮在需求契約通過後、開始寫碼前自動載入。"
  },
  "prompt": null,
  "links": [
    {
      "label": "GitHub Spec Kit",
      "url": "https://github.com/github/spec-kit"
    },
    {
      "label": "Superpowers writing-plans",
      "url": "https://github.com/obra/superpowers/tree/main/skills/writing-plans"
    }
  ],
  "addedAt": "2026-08-12",
  "updatedAt": "2026-08-12"
}
