{
  "id": "gsap",
  "name": "GSAP",
  "summary": "讓網頁上的東西會動起來，淡入、滑動、跟著捲動都行。",
  "description": "GSAP 官方為 AI 準備的 skill 組合。內容涵蓋核心 tween 與 ease、多步驟時間軸編排、捲動驅動動畫（ScrollTrigger）、Flip／Draggable／SplitText 等外掛、React 與 Vue／Svelte 的正確用法、gsap.utils 工具函式，以及維持 60fps 的效能守則。\n官方 repo 拆成 8 個 SKILL.md 是為了讓 AI 只在需要時載入對應的那一份，但它們是同一套東西、實際使用時也是互相搭配，所以在這裡收成一筆，安裝時 8 個資料夾一起裝。",
  "category": "前端 / 動效",
  "tags": [
    "animation",
    "gsap",
    "javascript",
    "scroll",
    "react",
    "performance"
  ],
  "official": true,
  "featured": true,
  "author": "GreenSock",
  "license": "MIT",
  "usage": [
    "要寫任何 JS 動畫，不論 vanilla 還是 React／Vue／Svelte",
    "要做捲動驅動的動畫、pin 釘住或視差",
    "要編排多步驟、可播放／倒轉／中斷的動畫序列",
    "要處理 prefers-reduced-motion 與動畫效能"
  ],
  "highlights": [
    "8 份 SKILL.md 一次裝齊，AI 會依情境自動載入對應的那一份",
    "官方維護，內容跟著 GSAP 3 最新版本走",
    "GSAP 3.13 起全部外掛（含 SplitText、ScrollSmoother）都免費"
  ],
  "source": {
    "kind": "github",
    "url": "https://github.com/greensock/gsap-skills",
    "branch": "main",
    "subdir": "skills"
  },
  "parts": [
    {
      "dirName": "gsap-core",
      "name": "Core",
      "summary": "最基本的動起來，移動、放大、變透明都在這。"
    },
    {
      "dirName": "gsap-timeline",
      "name": "Timeline",
      "summary": "把好幾段動畫排成先後順序，像剪片一樣。"
    },
    {
      "dirName": "gsap-scrolltrigger",
      "name": "ScrollTrigger",
      "summary": "捲動頁面時觸發動畫，也能把畫面釘住不動。"
    },
    {
      "dirName": "gsap-plugins",
      "name": "Plugins",
      "summary": "額外的特殊效果，像拖曳、文字拆字、位置變換。"
    },
    {
      "dirName": "gsap-react",
      "name": "React",
      "summary": "在 React 做的網站裡要怎麼正確使用。"
    },
    {
      "dirName": "gsap-frameworks",
      "name": "Frameworks",
      "summary": "在 Vue、Svelte 這類網站裡怎麼用。"
    },
    {
      "dirName": "gsap-utils",
      "name": "Utils",
      "summary": "一些好用的小工具，算數值、隨機、限制範圍。"
    },
    {
      "dirName": "gsap-performance",
      "name": "Performance",
      "summary": "讓動畫跑得順、不卡頓的做法。"
    }
  ],
  "install": {
    "command": "npx skills add https://github.com/greensock/gsap-skills",
    "scope": "user",
    "files": [
      "SKILL.md"
    ],
    "requires": [],
    "notes": "請依目前 Agent 的官方安裝機制處理；8 個資料夾必須全部安裝，缺一份就會少掉對應主題的知識。"
  },
  "prompt": null,
  "links": [
    {
      "label": "GSAP AI Skills（官方 repo）",
      "url": "https://github.com/greensock/gsap-skills"
    },
    {
      "label": "GSAP 官方文件",
      "url": "https://gsap.com/docs/v3/"
    }
  ],
  "addedAt": "2026-08-03",
  "updatedAt": "2026-08-10"
}
